{
  "schema_version": 1,
  "name": "partition_code",
  "id_type": "integer",
  "origin": "external_assignment",
  "description": "Synthetic assignment IDs, no arithmetic order",
  "source_fields": [],
  "excluded_from_coverage": [
    -1
  ],
  "labels": [
    {
      "id": -1,
      "name": "Unassigned",
      "criteria": "Synthetic missing assignment"
    },
    {
      "id": 0,
      "name": "Segment A",
      "criteria": "Declared assignment code 0"
    },
    {
      "id": 1,
      "name": "Segment A",
      "criteria": "Distinct computational ID 1 despite duplicate display name"
    },
    {
      "id": 2,
      "name": "Segment C",
      "criteria": "Declared assignment code 2"
    }
  ]
}
